<?xml version="1.0" encoding="UTF-8"?>
<!DOCTYPE class SYSTEM "classroom.dtd">
<classroom cid="c1">
	<cname>班级1</cname>
	<grade>三年级</grade>
	<students>
		<student>
			<id>1</id>
			<name>aa</name>
			<age>10</age>
		</student>
		<student>
			<id>2</id>
			<name>bb</name>
			<age>20</age>
		</student>
	</students>
</classroom>